{
  "artifact_id": "domain-20260804120100",
  "agent_id": "business_domain",
  "agent_version": "1.0.0",
  "timestamp": "2026-08-04T12:01:00Z",
  "schema_version": "1.0.0",
  "scope": {
    "codebase_root": "files/legacy-app",
    "modules": [
      "claims"
    ]
  },
  "overall_confidence_score": 82,
  "business_domains": [
    {
      "domain_id": "DOM-claims",
      "domain_name": "Claims",
      "canonical_name": "Claims",
      "description": "Insurance claim intake and adjudication",
      "normalization_applied": false,
      "entities": [
        {
          "entity_id": "ENT-claim",
          "entity_name": "Claim",
          "canonical_name": "Claim",
          "entity_type": "aggregate",
          "attributes": [],
          "relationships": [],
          "confidence_score": 90,
          "extraction_source": "code",
          "evidence": [
            {
              "path": "claims/src/Claim.java",
              "kind": "code"
            }
          ]
        }
      ],
      "business_rules": [
        {
          "rule_id": "BR-claim-status-transition",
          "rule_name": "Claim status transition",
          "rule_category": "workflow",
          "rule_description": "Claim may move Submitted -> UnderReview -> Approved|Rejected",
          "pseudo_code": "if status==Submitted then allow UnderReview",
          "implementation_location": {
            "file_path": "claims/src/ClaimService.java",
            "method_name": "updateStatus",
            "line_numbers": [
              40,
              80
            ]
          },
          "validation_type": "server_side",
          "business_impact": "critical",
          "dependencies": [],
          "configuration_variations": [],
          "confidence_score": 88,
          "extraction_source": "code",
          "evidence": [
            {
              "path": "claims/src/ClaimService.java",
              "lines": [
                40,
                80
              ],
              "kind": "code"
            }
          ]
        }
      ],
      "cross_domain_dependencies": [],
      "confidence_score": 85
    },
    {
      "domain_id": "DOM-extra2",
      "domain_name": "Supporting Domain 2",
      "canonical_name": "Supporting Domain 2",
      "description": "Insurance claim intake and adjudication",
      "normalization_applied": false,
      "entities": [
        {
          "entity_id": "ENT-extra2",
          "entity_name": "Entity2",
          "canonical_name": "Claim",
          "entity_type": "aggregate",
          "attributes": [],
          "relationships": [],
          "confidence_score": 90,
          "extraction_source": "code",
          "evidence": [
            {
              "path": "claims/src/Claim.java",
              "kind": "code"
            }
          ]
        }
      ],
      "business_rules": [
        {
          "rule_id": "BR-claim-status-transition",
          "rule_name": "Claim status transition",
          "rule_category": "workflow",
          "rule_description": "Claim may move Submitted -> UnderReview -> Approved|Rejected",
          "pseudo_code": "if status==Submitted then allow UnderReview",
          "implementation_location": {
            "file_path": "claims/src/ClaimService.java",
            "method_name": "updateStatus",
            "line_numbers": [
              40,
              80
            ]
          },
          "validation_type": "server_side",
          "business_impact": "critical",
          "dependencies": [],
          "configuration_variations": [],
          "confidence_score": 88,
          "extraction_source": "code",
          "evidence": [
            {
              "path": "claims/src/ClaimService.java",
              "lines": [
                40,
                80
              ],
              "kind": "code"
            }
          ]
        }
      ],
      "cross_domain_dependencies": [],
      "confidence_score": 85
    },
    {
      "domain_id": "DOM-extra3",
      "domain_name": "Supporting Domain 3",
      "canonical_name": "Supporting Domain 3",
      "description": "Insurance claim intake and adjudication",
      "normalization_applied": false,
      "entities": [
        {
          "entity_id": "ENT-extra3",
          "entity_name": "Entity3",
          "canonical_name": "Claim",
          "entity_type": "aggregate",
          "attributes": [],
          "relationships": [],
          "confidence_score": 90,
          "extraction_source": "code",
          "evidence": [
            {
              "path": "claims/src/Claim.java",
              "kind": "code"
            }
          ]
        }
      ],
      "business_rules": [
        {
          "rule_id": "BR-claim-status-transition",
          "rule_name": "Claim status transition",
          "rule_category": "workflow",
          "rule_description": "Claim may move Submitted -> UnderReview -> Approved|Rejected",
          "pseudo_code": "if status==Submitted then allow UnderReview",
          "implementation_location": {
            "file_path": "claims/src/ClaimService.java",
            "method_name": "updateStatus",
            "line_numbers": [
              40,
              80
            ]
          },
          "validation_type": "server_side",
          "business_impact": "critical",
          "dependencies": [],
          "configuration_variations": [],
          "confidence_score": 88,
          "extraction_source": "code",
          "evidence": [
            {
              "path": "claims/src/ClaimService.java",
              "lines": [
                40,
                80
              ],
              "kind": "code"
            }
          ]
        }
      ],
      "cross_domain_dependencies": [],
      "confidence_score": 85
    }
  ],
  "business_capabilities": [
    {
      "capability_id": "CAP-claim-intake",
      "capability_name": "Claim Intake",
      "capability_description": "Submit and validate new claims",
      "supporting_domains": [
        "DOM-claims"
      ],
      "business_value": "Core revenue ops",
      "complexity_score": 60,
      "implementation_components": [],
      "business_rules_applied": [
        "BR-claim-status-transition"
      ],
      "data_dependencies": [],
      "integration_dependencies": [],
      "confidence_score": 80
    },
    {
      "capability_id": "CAP-002",
      "capability_name": "Capability 2",
      "capability_description": "Example capability 2 for schema floor validation",
      "supporting_domains": [
        "DOM-claims"
      ],
      "confidence_score": 70
    },
    {
      "capability_id": "CAP-003",
      "capability_name": "Capability 3",
      "capability_description": "Example capability 3 for schema floor validation",
      "supporting_domains": [
        "DOM-claims"
      ],
      "confidence_score": 70
    },
    {
      "capability_id": "CAP-004",
      "capability_name": "Capability 4",
      "capability_description": "Example capability 4 for schema floor validation",
      "supporting_domains": [
        "DOM-claims"
      ],
      "confidence_score": 70
    },
    {
      "capability_id": "CAP-005",
      "capability_name": "Capability 5",
      "capability_description": "Example capability 5 for schema floor validation",
      "supporting_domains": [
        "DOM-claims"
      ],
      "confidence_score": 70
    },
    {
      "capability_id": "CAP-006",
      "capability_name": "Capability 6",
      "capability_description": "Example capability 6 for schema floor validation",
      "supporting_domains": [
        "DOM-claims"
      ],
      "confidence_score": 70
    },
    {
      "capability_id": "CAP-007",
      "capability_name": "Capability 7",
      "capability_description": "Example capability 7 for schema floor validation",
      "supporting_domains": [
        "DOM-claims"
      ],
      "confidence_score": 70
    },
    {
      "capability_id": "CAP-008",
      "capability_name": "Capability 8",
      "capability_description": "Example capability 8 for schema floor validation",
      "supporting_domains": [
        "DOM-claims"
      ],
      "confidence_score": 70
    }
  ],
  "workflows": [
    {
      "workflow_id": "WF-001",
      "workflow_name": "Claims intake",
      "steps": ["Capture claim", "Validate policy", "Route to adjuster"],
      "capabilities": ["CAP-001"],
      "evidence": ["src/ClaimService.java:10"]
    },
    {
      "workflow_id": "WF-002",
      "workflow_name": "Policy renewal",
      "steps": ["Load policy", "Recalculate premium", "Issue renewal"],
      "capabilities": ["CAP-002"],
      "evidence": ["src/PolicyService.java:20"]
    },
    {
      "workflow_id": "WF-003",
      "workflow_name": "Payment posting",
      "steps": ["Receive payment", "Allocate", "Update balance"],
      "capabilities": ["CAP-003"],
      "evidence": ["src/PaymentService.java:30"]
    }
  ],
  "operation_dispatch_rules": [
    {
      "dispatch_key": "ClaimType",
      "condition": "type==AUTO",
      "handler": "AutoClaimHandler",
      "fallback": "DefaultClaimHandler",
      "evidence": ["src/ClaimRouter.java:12"]
    },
    {
      "dispatch_key": "ClaimType",
      "condition": "type==HOME",
      "handler": "HomeClaimHandler",
      "evidence": ["src/ClaimRouter.java:18"]
    },
    {
      "dispatch_key": "Channel",
      "condition": "channel==BATCH",
      "handler": "BatchIntake",
      "evidence": ["src/BatchRouter.java:5"]
    },
    {
      "dispatch_key": "Channel",
      "condition": "channel==ONLINE",
      "handler": "OnlineIntake",
      "evidence": ["src/OnlineRouter.java:5"]
    },
    {
      "dispatch_key": "Priority",
      "condition": "priority==HIGH",
      "handler": "FastTrack",
      "evidence": ["src/PriorityRouter.java:8"]
    }
  ],
  "feature_flags": [
    {
      "flag_name": "ENABLE_FAST_TRACK",
      "behavior_gated": "Routes high-priority claims to fast track",
      "default_state": "false",
      "source": "config",